ID,artworkName,artistName,time,description,size_in,size_cm,w,h,,,,,,,,,,,,,,
608,The Street,Philip Guston,1977,"""The Street"" is a serious investigation into states of disorder and confusion presented in the vernacular language of cartoon figures and naïve drawing. The composition is divided into three vertical sections, each depicting a different state of being: passive decay, violent aggression, and total disarray. At the right, a large trashcan is stuffed to overflowing with empty bottles, old strips of wood, a shoe, and other refuse. In the center is a barrage of disembodied limbs, hairy and paw-like, wielding trashcan lids as shields. These arms confront to the left a wave of skinny, interlocked legs whose movements seem thwarted by their own oversize shoes. Below, on the horizon line, which is the street itself, a pair of large spiders ominously sits poised for action.",69 in. × 9 ft. 3 in.,,,,,,,,,,,,,,,,,
609,Cardinal Fernando Niño de Guevara (1541–1609),El Greco,ca. 1600,"This intense portrait depicts Fernando Niño de Guevara (1541–1609), who in 1596 was named cardinal and is dressed as such here. In 1599 he became Inquisitor General of Spain but resigned in 1602 to serve the rest of his life as Archbishop of Seville. The painting probably dates from the spring of 1600 when the cardinal was in Toledo with Philip III and members of the Madrid court. El Greco had lived in Venice and in the Farnese Palace in Rome, where Titian’s portraits (such as those of the Farnese Pope Paul III) would have revealed to the Greek painter the psychological possibilities of portraiture.",67 1/4 x 42 1/2in.,,,,,,,,,,,,,,,,,
610,The Scream,Edvard Munch,1893,"The Scream (Norwegian: Skrik) is the popular name given to each of four versions of a composition, created as both paintings and pastels, by Norwegian Expressionist artist Edvard Munch between 1893 and 1910. The German title Munch gave these works is Der Schrei der Natur (The Scream of Nature). The works show a figure with an agonized expression against a landscape with a tumultuous orange sky. Arthur Lubow has described The Scream as ""an icon of modern art, a Mona Lisa for our time.""[1]",36 in × 28.9 in,,,,,,,,,,,,,,,,,
611,Reiter (Lyrishes),Wassily Kandinsky,1911,N/A,,,,,,,,,,,,,,,,,,
612,View of Toledo,El Greco,1600,"View of Toledo (original title Vista de Toledo), is one of the two surviving landscapes painted by El Greco. The other, View and Plan of Toledo lies at Museo Del Greco, Toledo, Spain. View of Toledo is among the best known depictions of the sky in Western art, along with Vincent van Gogh's The Starry Night and the landscapes of J. M. W. Turner and Claude Monet, among others. Most notable is the distinct color contrast between the dark and somber skies above and the glowing green hills below. While influenced by the Mannerist style, El Greco's expressive handling of color and form is without parallel in the history of art.[1] In this painting, he takes liberties with the actual layout of Toledo insofar as certain building locations are re-arranged. However, the location of the Castle of San Servando, on the left, is accurately depicted. El Greco's signature appears in the lower-right corner.",47.8 in × 42.8 in,,,,,,,,,,,,,,,,,
613,Sokea soittoniekka (Blind Musician),Alvar Cawén,1922,N/A,N/A,,,,,,,,,,,,,,,,,
614,Rehe im Walde,Franz Marc,1914,N/A,43.5 × 39.3 in,,,,,,,,,,,,,,,,,
615,Coney Island,Joseph Stella,1914,"A kaleidoscope of dazzling color and fragmented form, Stella’s abstract painting evokes the electric lights and energetic crowds of Brooklyn’s Coney Island amusement park and boardwalk. Celebrating the intoxicating and sometimes disorienting dynamism of modern life, Coney Island reveals the painter’s knowledge of Italian Futurism, which Stella was exposed to during a trip to Italy and France in 1910–11. The composition’s circular, or tondo, format links it to Renaissance depictions of holy subjects.",41-3/4 in.,,,,,,,,,,,,,,,,,
616,"Naked Man, Back View",Lucian Freud,1991,"For more than half a century, Freud has concentrated on depicting the human face and figure in paintings, drawings, and etchings. Earlier examples are smaller in scale and crafted in a distinctive, meticulous style with extreme precision. Freud's major compositions of the last thirty years are considerably larger, with heavily worked and impastoed surfaces. The model for this picture, Leigh Bowery (Australian, 1961–1994), was a performance artist in London.",72 × 54 in.,,,,,,,,,,,,,,,,,
617,Steeplechase,Milton Avery,1929,"""Steeplechase"" serves as an example of his artistic development soon after moving to New York. Weekend excursions to Coney Island, a popular, recreational ocean-side site in Brooklyn, were a favorite summer pastime for the Averys. Years later, Sally Avery reminisced: ""The subway fare to Coney Island was five cents; with…our sketchbooks in our knapsacks, we could spend a fascinating holiday at the beach. We reveled in the crowds…the wonderful smells of hot dogs and knishes…we listened to the barkers extolling the virtues of the bearded lady, the snake charmer, and the sword swallower—our free mini show."" In Avery's painting a bustling scene of Coney Island is presented, replete with sunbathers, crowds, tent, rifle range, and roller coaster. Humor is particularly apparent in the oddly shaped figures, posed awkwardly on the beach. Avery has achieved subtleties of tone with a limited range of color and a scumbled texture with his brushwork, in which thin layers of pigment were rubbed onto the canvas with a stiff brush, producing a swirl of marks. The composition achieves a sense of spatial depth through the arrangement of elements along successively receding horizontal layers.",32 x 40 in.,,,,,,,,,,,,,,,,,
618,The Beginning,Max Beckmann,1946,"As a child growing up in Leipzig, Germany, Beckmann was especially fond of illustrating imaginative journeys. In Beginning, Beckmann looks back to his childhood with fondness and humor. Completed in 1949 when the artist was sixty-five years old, the panels are autobiographical. Beckmann’s memories of his schooldays in Germany are balanced by a dream fantasy on the right and left panels, respectively. In the central panel, childhood memories and dreamworlds intermingle. Deeply impacted by both World Wars and his exile from Germany, Beckmann’s work typically integrates tragic themes with expressionistic brushwork and bright colors.",69 in. × 125 1/2 in.,,,,,,,,,,,,,,,,,
619,The Last Ones,Max Beckmann,1919,N/A,34 3/4 x 23 1/4 in.,,,,,,,,,,,,,,,,,
620,The False Front,Charles Burchfield,1920,N/A,21 x 30 in.,,,,,,,,,,,,,,,,,
701,Flying Dutchman,Man Ray,1920,"Rendered directly with a palette knife, Man Ray’s Flying Dutchman encroaches on pure abstraction and, in keeping with the Dada spirit of rebellion against tradition, manifests the artist’s rejection of conventional easel painting with a brush. He derived this composition from a photograph he captured of sheets hanging from a clothesline in the backyard of a New York City slum. The painting’s title suggests that the image of sheets blowing in the wind reminded him of ship sails and, more specifically, of the celebrated and tragic opera by Richard Wagner (1813–1883), The Flying Dutchman, the name of a ghost ship doomed to sail aimlessly forever, its sails in tatters.",18-1/2 × 24-1/2 in.,,,,,,,,,,,,,,,,,
702,Weltrevolution,Hannah Höch,1920,"This photograph reproduces a detail of Höch's large photomontage ""Cut with the Kitchen Knife Dada through the Last Weimar Beer Belly Cultural Epoch"". In it, Höch takes aim at the hypocrisies and moral bankruptcy of the Weimar Republic through the radical techniques of disorientation, negation, and disjunction.This new, fragmented art of cut and pasted clippings from the mass media allowed the Dadaists, in the words of George Grosz, to say ""in pictures what would have been banned by the censors."" Here, Höch sets into motion a swirling, anarchic panoply of military leaders, crowds, spinning machine parts, cabaret dancers, and Dadaist pranksters; the work's engagement with the social praxis--in terms of both its subject and its construction--marks a decisive rupture with traditional bourgeois modes of expression. Höch often reworked her photomontages, and this image records a crucial revision in the image's development: the removal of the charged textual fragment ""Weltrevolution"" (World Revolution) and its replacement by the relatively innocuous ""Die grosse Welt Dada"" (Big Dada World).",5 1/4 x 3 7/8 in.,,,,,,,,,,,,,,,,,
703,Pinc,Kurt Schwitters,1947,"Schwitters was associated with the ""anti-art"" Dada movement in Germany in the 1920s, though always maintained a sense of independence, christening his own work – which ranged from painting and collage to installation and writing – Merz. He derived this term from the German word Kommerz, or commerce; fittingly, he incorporated detritus from the commercial world – waste materials he found on the streets of Hanover – into his meticulously arranged Merzbilder, or Merz Pictures. In this and other late works created while he was living in exile in England, Schwitters incorporated bits of comic strips sent to him by a friend in the United States.",7 1/4 x 6 in.,,,,,,,,,,,,,,,,,
704,ABCD,Raoul Hausmann,1920,"As a founder of the Berlin incarnation of Dada, Hausmann searched for a vital, disruptive, and realistic art, piecing together scraps of word and image—the detritus of the real world—to make symbolic and explosive new pictures. ABCD is a self-portrait. Below the artist's face is an announcement of his performance of a phonetic poem. The letters VOCE (Italian for ""voice"") appear inside an earlike ellipse, and the letters ABCD, a prototypical poem, are clinched in the artist's teeth. The tickets to the Kaiserjubilee in his hat indicate the empty formalities of the social milieu in which he functioned, while the intentionally provocative gynecological diagram alludes to the organic necessity of his art.",5 15/16 x 4 in.,,,,,,,,,,,,,,,,,
705,The Barbarians,Max Ernst,1937,"In this small painting, a gigantic, malevolent-looking bird couple marches forward with seemingly mile-long strides. The dark female leads the way as her male companion turns to look at the strange animal-perhaps their offspring-clinging to his left arm. In the far distance, a tiny woman holds onto some undefined winged being. The strange patterns on the bodies of the main figures, which evoke fossils or geological formations, are the result of grattage (scraping). In this technique, the artist coated the canvas, or in this case, a piece of cardboard, with layers of paint and while it was still wet pressed it against objects that left imprints on the surface. Afterward, he used a brush to touch up the forms thus created, or scraped away layers of pigment.",9 1/2 x 13 in.,,,,,,,,,,,,,,,,,
706,At the Bar,Marcel Duchamp,1909,N/A,"H. 15-1/8, W. 11-1/2 inches",,,,,,,,,,,,,,,,,
707,Compass,Man Ray,1920,"Before leaving Paris for New York in 1921, Man Ray made several constructions that questioned the authority of logic and science over the imagination. This quirky instrument, which he called ""Compass,"" was one. The fields of force to which it might respond are as erratic and potentially as destructive as a game of Russian roulette. After making the exposure, Man Ray characteristically disassembled the magnet-and-pistol device, leaving only this single original print as the reminder of a provocative Dada idea. It is ""purely cerebral yet material"" (as Man Ray said of Marcel Duchamp's ""Large Glass""), whimsical yet deadly earnest.",4 5/8 x 3 3/8 in.,,,,,,,,,,,,,,,,,
708,La table servie,Jacques Villon,1912,"""La table servie"" is one of a fascinating series of paintings and works on paper preoccupied with the dining table set for lunch. Villon's subject evolved from a distant view of a table with objects resting on it to multiple views of the objects described in true Cubist fashion. On the unfolded tablecloth a meal is arranged, with an assortment of overlapping objects that undergo a thorough Cubist analysis: a carafe, a Chianti bottle, a bowl, a cup and saucer, a pitcher, a plate, and a bouquet of flowers. As distinct from other working sketches of the still life, the Lehman drawing is primarily a linear exercise, a study of line as it passes rhythmically through objects and space. The squared grid was used to transfer the complex distribution of objects to one of the related paintings in the series.",11 7/16 x 15 7/16 in.,,,,,,,,,,,,,,,,,
709,Tristan Tzara,Man Ray,1921,"Man Ray was among the instigators of Dada in New York in the late 1910s. His subject is the Romanian-born writer (1896-1963) who helped found Zurich Dada and achieved notoriety for composing verse from cut up and rearranged bits of newspaper and who guided Man Ray through Paris upon his arrival in 1921. Shot in Man Ray's room on the rue de la Condamine (next door to his friend Marcel Duchamp), the photograph shows one of his violent sculpture-objects (such as the pistol-with-magnet entitled Compass of two years earlier) dangling over the poet, who coolly ignores his doubly assured destruction with the wave of a cigarette. This picture was also sandwich printed by the artist with another image featuring a giant topless female model looming imperiously over the morbid proceedings-a transitional moment between Dada's wicked humor and the woman-obsessed fever dreams of the emerging Surrealists.",4 1/8 x 3 7/16 in.,,,,,,,,,,,,,,,,,
710,The Art Critic,Raoul Hausmann,1920,"Hausmann, a founder member of the Berlin Dada group, developed photomontage as a tool of satire and political protest. Although the 'art critic' is identified by a stamp as George Grosz, another member of the group, the image was probably an anonymous figure cut from a magazine. The fragment of a German banknote behind the critic’s neck suggests that he is controlled by capitalist forces. The words in the background are part of a poem poster made by Hausmann to be pasted on the walls of Berlin.",,,,,,,,,,,,,,,,,,
801,Beat the Whites with the Red Wedge,El Lisitskiy,1920,"Beat the Whites with the Red Wedge is one of Lissitzky's earliest attempts at propagandistic art. He produced this politically charged work in support of the Red Army shortly after the Bolsheviks had waged their revolution in 1917. The red wedge symbolized the revolutionaries, who were penetrating the anti-Communist White Army. Here Lissitzky uses his signature coded color combination of red, white and black, which reinforces the message indicated by the work's title. Colors and shapes take on directly symbolic significance. For example, the smooth, curvilinear walls of the white circle are pierced by the sharp point of the red triangle: the Red Army has pierced the defenses of the White Army. Dramatic color contrasts also create confusion regarding space-which area is positive? Which is negative? Meanwhile, small geometric forms in the limited color scheme float like tiny projectiles through the space along with text. Here, basic forms combine with actual text: painting and typography are fused. This work is an important precursor to Lissitzky's Prouns, when Suprematist art moved onto a three-dimensional visual plain.",various,,,,,,,,,,,,,,,,,
802,Monument to the Third International,Vladimir Tatlin,1920,"Monument to the Third International, also sometimes known simply as Tatlin's Tower, is the artist's most famous work, as well as the most important spur to the formation of the Constructivist movement. The Tower, which was never fully realized, was intended to act as a fully functional conference space and propaganda center for the Communist Third International, or Comintern. Its steel spiral frame was to stand at 1,300 feet, making it the tallest structure in the world at the time - taller, and more functional—and therefore more beautiful by Constructivist standards—than the Eiffel Tower. There were to be three glass units, a cube, cylinder and cone, which would have different spaces for meetings, and these would rotate once per year, month, and day, respectively. For Tatlin, steel and glass were the essential materials of modern construction. They symbolized industry, technology and the machine age, and the constant motion of the geometrically shaped units embodied the dynamism of modernity. Although the tower was commissioned as a monument to revolution, and although it was given considerable prominence by the Bolshevik regime, it was never built, and it has continued to be an emblem of failed utopian aspirations for many generations of artists since.",,,,,,,,,,,,,,,,,,
803,Composition,Aleksandr Rodchenko,1918,N/A,"13 x 6 3/8""",,,,,,,,,,,,,,,,,
804,"Pure Red Color, Pure Yellow Color, Pure Blue Color",Aleksandr Rodchenko,1921,"Traditionally, color is used in art to describe the appearance of a particular object, or else to lend associations (the blue traditionally used to depict the Virgin Mary's robes in Renaissance paintings carried symbolic meanings). But Rodchenko's triptych focuses only on the material character of color, and it is considered the first artwork to do so. Here, red, blue, and yellow are used neither to describe an object nor to elicit certain associations; instead they are presented almost as a palette from which the artist can work. This is typical of the Constructivist attitude to materials, which was focused not on transforming them into art but on utilizing their properties in the most honest and effective ways possible. The triptych might be read as a rejection of the mysticism that seemed to tinge some work by Rodchenko's Suprematist contemporary, Kazimir Malevich. Rodchenko wrote of it, in 1921, ""I reduced painting to its logical conclusion and exhibited three canvases: red, blue, yellow. I affirmed: this is the end of painting. These are the primary colors. Every plane is a discrete plane and there will be no more representation.""",N/A,,,,,,,,,,,,,,,,,
805,Textile Design,Lyubov Popova,1924,"Popova first emerged as an Impressionist painter, but she was later drawn into Constructivist and Suprematist circles. By 1921 she had abandoned painting to pursue the Constructivist ambition to leave behind traditional art forms and to make work for mass production. She concentrated on textile design, such as in this work, Popova uses repeating geometric patterns which were thought more appropriate to modern life and mass production than the floral designs that had previously been popular for such textiles. The intersecting circles and spacing of the stripes add tension and movement within the pattern, while also visually creating the effect of different textures. Popova's prominence within Constructivism is indicative of the significant role played by women in driving the movement's concerns; other avant-garde movements of the period were dominated by men.",,,,,,,,,,,,,,,,,,
806,Painterly Architectonic,Lyubov Popova,1917,"In 1919 Popova described painting as a ""construction,"" the building blocks of which were color and line. In this work, brightly colored, irregularly shaped planes are layered against a neutral background. The curved bottom edge of a gray shape emerging from beneath a red triangle and a white trapezoid suggests three-dimensionality, while the vibrant colors and jutting edges that seem to extend beyond the frame evoke energetic movement. Painterly Architectonic is one of a series of works Popova created between 1915 and 1919 in response to Kazimir Malevich's Suprematist paintings. Her definition of painting as a constructive process also recalls her engagement with the materially based abstraction of fellow Russian Vladimir Tatlin, in whose teaching studio she worked.","31 1/2 x 38 5/8""",,,,,,,,,,,,,,,,,
807,The Globetrotter from Figurines,El Lisitskiy,1920,N/A,"14 3/16 x 10 1/4""",,,,,,,,,,,,,,,,,
808,Proun 1 D,El Lisitskiy,1920,"Lithograph from a portfolio of eleven lithographs with unique manuscript manifesto in Russian and German, colophon, and front and back covers of gouache, ink and pencil","8 7/16 x 10 9/16""",,,,,,,,,,,,,,,,,
809,Old Man,El Lisitskiy,1920,N/A,"10 1/8 x 10 5/8""",,,,,,,,,,,,,,,,,
810,"New York, Number 18",Charles Biederman,1938,"In the early years of his career as a painter, Charles Biederman studied Cézanne, Post-Impressionism, and Cubism before finally turning to total abstraction. His time in New York (1934-40) and his first trip to Paris in 1936 definitively shaped his art as he came into contact with the work of many European modernists, including Arp, Brancusi, Léger, Miró, and Mondrian, Pevsner, and Vantongerloo. He was particularly interested in Constructivism (with its use of industrial materials) and De Stijl (with its rigid geometry and primary color schemes), two art movements that produced geometric, nonobjective images. By 1937, Biederman's work was becoming more sculptural, and subsequent pieces, such as New York, Number 18 of 1938, were rendered as shallow, painted reliefs. These wall-hung panels-often incorporating wood and plastic materials-could be seen from various angles, and natural light and cast shadows enhanced the visual effect. Here, the central portion of the rectangular box has a recessed center, cut out to form a number of right angles; translucent plastic sheets set into the hollow add a shock of yellow to the otherwise white scheme.",30 3/4 in. × 21 7/8 in. × 4 in.,,,,,,,,,,,,,,,,,
1001,Mao,Andy Warhol,1973,"Mao is one of a series of silkscreened portraits of the Chinese Communist leader Mao Zedong (1893–1976) that Warhol produced in 1973. Nearly 15 feet tall, this towering image mirrors representations that were displayed throughout Chinaduring and after the Cultural Revolution (1966–76). Warhol was undoubtedly drawn to this subject because of the media’s attention to the opening of diplomatic relations with the People's Republic of China in the early 1970s. His irreverent attitude toward China’s totalitarian propaganda is apparent on the surface of the painting. Flamboyant brushstrokes compete with the photographic image, forming color splashes on Mao’s clothing. Red rouge and blue eye shadow resemble graffiti. These details can be interpreted as commentary on the resemblance of Communist propaganda to capitalist advertising media.",176 1/2 x 136 1/2 in.,,,,,,,,,,,,,,,,,
1002,Double Elvis,Andy Warhol,1963,"In Double Elvis, Warhol created a strobe effect by overlapping two images of the singer—most likely sourced from a publicity still for the Western film Flaming Star (1960). The silver background conveys a sense of glamour, while also serving a practical purpose—the opacity of the spray paint allowed Warhol to easily mask and silkscreen multiple images on top of each other. Double Elvis originally belonged to a long, continuous canvas of Elvises that was later cut and stretched into multiple paintings. The artist’s interest in film might explain why he created Elvis in double—the singer/actor appears to be moving back and forth, as if in a film strip.","6' 11"" x 53""",,,,,,,,,,,,,,,,,
1003,Flowers,Andy Warhol,1963,"Obsessed with celebrity, consumer culture, and mechanical (re)production, Pop artist Andy Warhol created some of the most iconic images of the 20th century. As famous for his quips as for his art—he variously mused that “art is what you can get away with” and “everyone will be famous for 15 minutes”—Warhol drew widely from popular culture and everyday subject matter, creating works like his 32 Campbell's Soup Cans (1962), Brillo pad box sculptures, and portraits of Marilyn Monroe, using the medium of silk-screen printmaking to achieve his characteristic hard edges and flat areas of color. Known for his cultivation of celebrity, Factory studio (a radical social and creative melting pot), and avant-garde films like Chelsea Girls(1966), Warhol was also a mentor to artists like Keith Haring and Jean-Michel Basquiat. His Pop sensibility is now standard practice, taken up by major contemporary artists Richard Prince, Takashi Murakami, and Jeff Koons, among countless others.","21 15/16 x 21 15/16""",,,,,,,,,,,,,,,,,
1004,Campbell's Soup Cans,Andy Warhol,1962,"Though Campbell’s Soup Cans resembles the mass-produced, printed advertisements by which Warhol was inspired, it is hand-painted, while the fleur de lys pattern ringing each can’s bottom edge is hand-stamped. In this work, he mimicked the repetition and uniformity of advertising by carefully reproducing the same image across each individual canvas. He varied only the label on the front of each can, distinguishing them by their variety. Warhol said of Campbell’s Soup, “I used to drink it. I used to have the same lunch every day, for 20 years, I guess, the same thing over and over again.”","20 x 16""",,,,,,,,,,,,,,,,,
