ID,artworkName,artistName,time,description,size_in,size_cm,w,h,,,,,,,,,,,,,,
407,Le séchage des voiles (The Drying Sails),André Derain,1905,"The picture was painted at Collioure, a small sea town in the south of France, and is also known under the name Fishing Boats. The artist's liberated manner is seen in the bright colours and freely applied brushstrokes that leave patches of priming and canvas uncovered. The painting was shown at the famous Fauvist exhibition in the 1905 Salon d'Automne and acquired by Ivan Morozov shortly afterwards.",,82 x 101 cm,,,,,,,,,,,,,,,,
408,Barges on the Seine,Maurice de Vlaminck,1905,N/A,,81 x 100 cm,,,,,,,,,,,,,,,,
409,Portrait of Madame Matisse,Henri Matisse,1905,"This depiction of the artist’s wife, Amélie, is one of Matisse’s most famous paintings and a masterpiece within 20th century portraiture. 
Much of its strength resides in its simple geometric structure and in the way in which the colours are combined. Spatial modulation is pared back to a minimum. Effects of light and shadow, which would have added depth to the image, have been translated into planes of colour instead.",,40.5 x 32.5 cm,,,,,,,,,,,,,,,,
410,L'Olivier près de l'Estaque (The Olive tree near l'Estaque),Georges Braque,1906,"Georges Braque was a major 20th-century French painter, collagist, draughtsman, printmaker and sculptor. His most important contributions to the history of art were in his alliance with Fauvism from 1906, and the role he played in the development of Cubism. Braque’s work between 1908 and 1912 is closely associated with that of his colleague Pablo Picasso. Their respective Cubist works were indistinguishable for many years, yet the quiet nature of Braque was partially eclipsed by the fame and notoriety of Picasso.",N/A,N/A,,,,,,,,,,,,,,,,
411,La jetée à L'Estaque,André Derain,1906,N/A,,38 x 46 cm,,,,,,,,,,,,,,,,
412,The River Seine at Chatou,Maurice de Vlaminck,1906,"This scene depicts the portion of the Seine that runs through Chatou, the Paris suburb where de Vlaminck and Derain shared a studio beginning in 1901. For The River Seine, de Vlaminck used impasto (a technique practiced by many Fauves): thick daubs of paint applied directly from the tube, then brushed together in short strokes to create the effect of movement. For the water and sky, de Vlaminck used a range of blues and greens, as well as dazzling white highlights applied in choppy dabs; the two red-and-orange trees at the left provide a lively contrast. The finished effect is one of brightness and vibrating motion; detail and traditional perspective matter far less than a sense of buoyant pleasure. As de Vlaminck said, ""I try to paint with my heart and my guts without worrying about style.""",32 1/2 x 40 1/8 in.,82.5 x 102 cm,,,,,,,,,,,,,,,,
413,Paysage coloré aux oiseaux aquatiques,Jean Metzinger,1907,"Paysage coloré aux oiseaux aquatiques (Colored Landscape with Aquatic Birds). The work represents three aquatic birds in an ambrosial Mediterranean landscape with semi-tropical vegetation, trees, a body of water, mountains and a sailboat in the background. The free and expressive brushstrokes of Paysage coloré aux oiseaux aquatiques—as in Les Ibis and Le Flamant rose et le voilier of the same period—represent a loosening of the mosaic-like Divisionist technique that characterized Metzinger's work from 1905 to early 1907.",29.7 in × 39.8 in,75.5 cm × 101 cm,,,,,,,,,,,,,,,,
414,"Paysage (Le Bec de l'Aigle, La Ciotat)",Othon Friesz,1907,"Achille Émile Othon Friesz, a native of Le Havre in France, moved to Paris to study art in 1898 and became part of the circle that included Matisse, Rouault, Marquet, and Dufy. For this work, Friesz used warm tones of yellow and red accentuated by touches of green. Although he was a devoted Fauvist for as long as any of his contemporaries, Friesz's approach to the canvas was far more traditional, his color choices were more deliberate, and his application of paint was more methodical. In this sense, Friesz painted an Impressionist-style landscape using Fauvist color.",25 3/8 in. x 32 in. ,64.45 cm x 81.28 cm,,,,,,,,,,,,,,,,
415,Jeanne dans les fleurs,Raoul Dufy,1907,"Like the Impressionists, Dufy was fond of painting gardens and flowers, but this scene of his family's garden, composed in a shallow, tightly cropped space, was a more expressive work of art. His ambiguous mingling of foreground and background through the curves of the foliage, his raw brushwork, and his non-naturalistic use of color (even in the skin of his model, his sister Jeanne) exemplify Fauvism's freedom from literal physical appearances and its new stress on color's intrinsic emotional power.",,90.5 x 77.5 cm,,,,,,,,,,,,,,,,
416,Blue Nude,Henri Matisse,1907,"Matisse shocked the French public at the 1907 Société des Artistes Indépendants when he exhibited Blue Nude (Souvenir de Biskra). The Blue Nude was one of the paintings that would later create an international sensation at the Armory Show of 1913 in New York City.

The painting, which may be classified as Fauvist, was controversial; it was burned in effigy in 1913 at the Armory Show in Chicago, to where it had toured from New York. In 1907 the painting had a strong effect on Georges Braque and Pablo Picasso, partially motivating Picasso to create Les Demoiselles D'Avignon.",36.3 in × 55.2 in,,,,,,,,,,,,,,,,,
417,Paysage à La Ciotat,Othon Friesz,1907,N/A,,59.9 x 72.9 cm,,,,,,,,,,,,,,,,
418,Le Viaduc a l'Estaque,Georges Braque,1908,"Between 1905 and 1908, Braque painted the landscapes of L'Estaque (a setting also favored by Cezanne) in different color palettes. This 1908 composition reveals Braque's combination of Fauvist color and simplification of form with a nascent interest in volume and multiple perspective: the rounded arches of the ancient viaduct connect both sides of the landscape in the distance, but the foreground is a carefully arranged stack of boxy houses and vigorously brushed greenery. Le Viaduc a l'Estaque foreshadows Braque's future role in the development of Cubism, the next major modern movement of the 20th century.",,"72, 5 x 59 cm",,,,,,,,,,,,,,,,
419,La Dance,Henri Matisse,1910,"Dance and its pendant Music were two of Matisse's late Fauvist works, the culmination of his work in this style. These large-scale canvases were commissioned by the Russian merchant Sergei Shchukin, a major patron of avant-garde art in that period. The arrangement of figures in a circular dance is a centuries-old motif, often used to suggest a golden age of harmony and leisure. However, by simplifying and distorting his dancers' anatomy for expressive purposes, and painting them in a vibrant, non-naturalistic red against a flat ground of blue sky and green earth, Matisse emphasized the primordial aspect of dance. The figures' extremities brush the edges of the composition, as if their dynamism were barely contained by the canvas.",,260 x 391 cm,,,,,,,,,,,,,,,,
420,L'Atelier Rouge (The Red Studio),Henri Matisse,1911,"Matisse dismantled the conventional distinctions between foreground and background, figure and space. Color and perspective are both non-naturalistic in this work: the canvas is one broad field of saturated crimson. When asked about this choice of color, Matisse commented, ""Where I got the color red - to be sure, I just don't know. I find that all these things...only become what they are to me when I see them together with the color red."" The delicate, pale outlines of furniture and walls are actually underpainting revealed from behind the red, and they are not consistent with any traditional perspectival system.",,162 x 130 cm,,,,,,,,,,,,,,,,
501,Deux Nus,Jean Metzinger,1910-1911,"Deux Nus (Two Nudes, Two Women) is an early Cubist painting by the French artist and theorist Jean Metzinger. The work was exhibited at the first Cubist manifestation, in Room 41 of the 1911 Salon des Indépendants, Paris. At this exhibition the Cubist movement was effectively launched before the general public by five artists: Metzinger, Gleizes, Le Fauconnier, Delaunay and Léger. This was the first exhibition during which artists, writers, critics and the public at large encountered and spoke about Cubism. The result of the group show is a succès de scandale.",36 in × 26 in,92 cm × 66 cm,,,,,,,,,,,,,,,,
502,Violin and Candlestick,Georges Braque,1910,N/A,,60.96 x 50.17 cm,,,,,,,,,,,,,,,,
503,La Femme aux Phlox,Albert Gleizes,1910,"The painting was exhibited in Room 41 at the Salon des Indépendants in the Spring of 1911; the exhibition that introduced Cubism as a group manifestation to the general public for the first time. The complex collection of geometric masses in restrained colors exhibited in Room 41 created a scandal from which Cubism spread throughout Paris, France, Europe and the rest of the world. 
The painting represents a woman sitting in an interior setting, with a vase of flowers (phloxes) in front and another to her left. The window behind the sitter opens out onto an exterior scene, the whole blurring the distinction between interior and exterior.",31 in × 39 in,,,,,,,,,,,,,,,,,
504,L'Abondance (Abundance),Henri Le Fauconnier,1910,"Henri Victor Gabriel Le Fauconnier (July 5, 1881 – December 25, 1946) was a French Cubist painter born in Hesdin. Le Fauconnier was seen as one of the leading figures among the Montparnasse Cubists. At the 1911 Salon des Indépendants Le Fauconnier and colleagues Jean Metzinger, Albert Gleizes, Fernand Léger and Robert Delaunay caused a scandal with their Cubist paintings.",,,,,,,,,,,,,,,,,,
505,Still Life with a Bottle of Rum,Pablo Picasso,1911,"Pablo Picasso was a Spanish painter, sculptor, printmaker, ceramicist, stage designer, poet and playwright who spent most of his adult life in France. Regarded as one of the most influential artists of the 20th century, he is known for co-founding the Cubist movement. 
Portrait of Daniel-Henry Kahnweiler is a 1910 oil on canvas painting by Pablo Picasso in the Analytical Cubism style.",,,,,,,,,,,,,,,,,,
506,Les Joueurs de football,Albert Gleizes,1912,"Les Joueurs de football, also referred to as Football Players. The work was featured at Galeries Dalmau in Barcelona, 29 November – 12 December 1916, Gleizes' first one-person show. Gleizes employs a wide array of primary colors, grays, earth tones and umbers. Unlike the preferred subject matter of Pablo Picasso and Georges Braque, Gleizes has depicted a vast scene, combining a sporting event with a semi-urban or industrial landscape in the background. The rich juxtaposition of divers elements present within the piece are tied together in a Cubist idiom by an interlocking grid of diagonal lines, facets, intersecting plains and spheres.",88.75 in × 72.04 in,,,,,,,,,,,,,,,,,
507,Maquette for Guitar,Pablo Picasso,1912,"Picasso's experiments with collaged elements encouraged him to reconsider sculpture as well. Rather than a collage, however, Maquette for Guitar is an assemblage (or three-dimensional collage). While traditional sculpture was made up of a mass (or solid) surrounded by a void, using a material such as wood or marble that was then shaped by the hand of the artist, Picasso here takes pieces of cardboard, paper, string, and wire that he then folded, threaded, and glued together. This is the first time that a sculpture had been assembled from disparate parts. Rather than being a solid material, it fluidly integrates mass and its surrounding void. Picasso translated the Cubist interest in multiple perspectives and geometric form into a three-dimensional medium.",N/A,191 x 123 cm,,,,,,,,,,,,,,,,
508,Man on a Balcony,Albert Gleizes,1912,"Gleizes deliberately contrasts angular and curved shapes, while the tubular, block-like forms of the figure and head are derived directly from the principled of Cubism, as laid out in Du ""Cubisme"".",,61.3 × 50.5 cm,,,,,,,,,,,,,,,,
509,"Kiss of Death, oil on canvas",Bohumil Kubišta,1912,N/A,,55 × 45 cm,,,,,,,,,,,,,,,,
510,La Source (The Spring),Francis Picabia,1912,N/A,,200.7 × 222.9 cm,,,,,,,,,,,,,,,,
511,"Bouteille, clarinet, violon, journal, verre",Pablo Picasso,1913,"Pablo Picasso was a Spanish painter, sculptor, printmaker, ceramicist, stage designer, poet and playwright who spent most of his adult life in France. Regarded as one of the most influential artists of the 20th century, he is known for co-founding the Cubist movement. ",,32 in × 24 in,,,,,,,,,,,,,,,,
512,Conquest of the Air,Robert de la Fresnaye,1913,"La Fresnaye's colorful and optimistic paintings did much to popularize Cubism before World War I. In The Conquest of Air, his most famous work, he depicts himself with his brother Henri, sitting at a table outdoors. The yellow hot-air balloon in the distant background likely refers to the oldest balloon race in the world, the Gordon Bennett cup, which took place annually from 1906 to 1938, with breaks during the war years. The race alternated between European cities, but was held first in Paris in 1906 and again in 1913. A French crew won the race in 1912, adding to their national honor in this arena as the French had invented the hot-air balloon in 1783, no doubt explaining the celebratory French flag in the painting.",,N/A,,,,,,,,,,,,,,,,
513,Soldier at a Game of Chess,Jean Metzinger,1914,"The vertical composition is painted in a geometrically advanced Cubist style, representing a solitary French soldier playing a game of chess. He wears a military hat (képi) and bears a cigarette in his mouth. Because of this, Joann Moser suggests that this may be a self-portrait. Images of Metzinger often depicted him with a cigarette in his mouth: consider for example Robert Delaunay's 1906 Portrait of Metzinger (Man with a Tulip); Suzanne Phocas, Portrait de Metzinger, 1926.",,,,,,,,,,,,,,,,,,
514,Electric Prisms,Sonia Delaunay,1914,"Robert and Sonia Delaunay exhibited with the Salon Cubists, and later founded the Orphism movement that was heavily influenced by Cubism. Like all Cubists, they used geometric forms and flattened perspective to show visual manipulation of their subject, but the Delaunays in particular had metaphysical interests in color and concept, often overlapping multiple scenes and views to suggest a fourth dimension. Electric Prisms uses the sphere to represent this idea of overlap. In the work, different spheres convene into large concentric circles that are arranged to depict dynamic movement of electricity. Orphism was a short-lived movement but was a key phase in the transition from Cubism to non-representational art.",,235.9 x 195.6 cm,,,,,,,,,,,,,,,,
515,"Still Life with Open Window, Rue Ravignan",Juan Gris,1915,"Of the Salon Cubists, Juan Gris' work is often considered closest to that of Picasso and Braque with whom Gris was in close contact beginning in 1911. By 1914, Gris had developed collage techniques in which he pasted elements from newspapers and magazines onto deconstructed, abstract scenes. His works were sometimes actual collages, but could also be paintings that resembled collages as in Still Life with Open Window. In this work Gris combined interior and exterior views through interlocking elements and subtle shifts in color, including an intense blue that suffuses the work and, like Synthetic Cubism, reintroduces color to the Cubist style.",w35 x h45.63 in,56 x 47 cm,,,,,,,,,,,,,,,,
516,Femme au miroir,Jean Metzinger,1916,"Femme au miroir (en. Woman with a Mirror), or Lady at her Dressing Table, is a painting by the French artist Jean Metzinger. This distilled synthetic form of Cubism exemplifies Metzinger's continued interest, in 1916, towards less surface activity, with a strong emphasis on larger, flatter, overlapping abstract planes. The manifest primacy of the underlying geometric configuration, rooted in the abstract, controls nearly every element of the composition. The role of color remains primordial, but is now restrained within sharp delineated boundaries in comparison with several earlier works. The work of Juan Gris from the summer of 1916 to late 1918 bares much in common with that of Metzinger's late 1915, early 1916 paintings.",36.37 in × 25.62 in,,,,,,,,,,,,,,,,,
517,Bohémien Jouant de L'Accordéon (The Accordion Player),Gino Severini,1919,N/A,N/A,183.5 x 251.5 cm,,,,,,,,,,,,,,,,
518,Woman with Black Glove,Albert Gleizes,1920,"the work represents a woman wearing a glove. The overall color scheme is warm, consisting of red through yellow, browns and tans (earth tones, ochres), and black, along with varying shades of cool gray. The artists use of bold contrasts between light and dark affect the entire composition. However, there is a striking absence of chiaroscuro modeling that would otherwise indicate a sense of volume in modeling the three-dimensional figure, or give a sense of the direction of light cast upon the model. The overt distillation of the composition, with its emphasis placed on flat surface activity, large overlapping planes, and the primacy of the underlying geometric structure rooted in the abstract, is consistent with Crystal Cubism, which represents a break from the first phase of Cubism.  ",49.6 in × 39.37 in,195.6 cm × 114.9 cm,,,,,,,,,,,,,,,,
519,Three Musicians,Pablo Picasso,1921,"Three Musicians is the title of two similar collage and oil paintings by Spanish artist Pablo Picasso. They were both completed in 1921 in Fontainebleau near Paris, France, and exemplify the Synthetic Cubist style; the flat planes of color and ""intricate puzzle-like composition"" echoing the arrangements of cutout paper with which the style originated. These paintings each colorfully represent three musicians wearing masks in the tradition of the popular Italian theater Commedia dell'arte.",,"154,5 x 90 cm",,,,,,,,,,,,,,,,
520,Three Women,Fernand Léger,1921,"In Three Women, Léger updates the traditional theme of the reclining nude into a modern vocabulary that combines his various influences from Cubism and Futurism. The geometric forms of the figures indicate his Cubist sources, while his reliance on machine-like imagery is borrowed from Futurism. His pristine and colorful geometric forms are, however, much different from the faux low-relief sculptural effects used in Analytic Cubism. The shapes that make up the figures and objects, for example, do not overlap in the foreground, but are used to create an illusion of three-dimensionality. Thus, the furniture, the bodies of the women, and the spaces between them are easily distinguished.","6' 1/4"" x 8' 3""",249.6 x 249.3 cm,,,,,,,,,,,,,,,,
601,Portrait of a German Officer,Marsden Hartley,1914,"This monumental painting is the centerpiece of a series that evokes the dynamism, pageantry, and danger of life in Berlin during World War I. The painting’s collagelike appearance, dramatic color, and emotional brushwork attest to Hartley’s skillful synthesis of Cubism and German Expressionism. Hartley’s composition is an abstract portrait of Karl von Freyburg, a Prussian lieutenant whom the artist loved and who died in the war. Von Freyburg is portrayed symbolically with the initials, ""K.v.F.""; his regiment number, 4; his age at death, 24; and the Iron Cross that he received posthumously.",68 1/4 x 41 3/8 in.,,,,,,,,,,,,,,,,,
602,Water of the Flowery Mill,Arshile Gorky,1944,"Water of the Flowery Mill is part of a group of landscape-inspired works that Gorky produced during the last six years of his life. Based on his study of an old mill and bridge on the Housatonic River in Connecticut, it also evokes the artist’s nostalgia for Armenia, from which he and his family had fled some twenty years earlier. Influenced by Surrealism, Gorky’s fluid, biomorphic abstraction translates the landscape into flat, overlapping fields of color and seems to anticipate the gestural brushwork of Abstract Expressionism, a movement that emerged in the 1950s.",42 1/4 x 48 3/4 in.,,,,,,,,,,,,,,,,,
603,War,Jackson Pollock,1947,"Pollock's famous ""War"" is the only drawing he ever titled, and, although inscribed ""1947,"" it relates to the iconographically complex images he produced earlier, around 1943–44. In this composition, the monstrous destruction of war is conveyed both by the fierceness of the graphic execution and by the imagery, much of which is camouflaged by the many linear motions, darkened and thickened and highlighted with flashes of red and yellow pencil to heighten the dramatic intensity. The drawing's narrative is one of horrific proportions. A human figure and a bull are flung onto a raging pyre of human debris. To the right, the crucifixion of a hooded figure is suggested. Some of the imagery may be traced to Picasso's pair of etchings ""The Dream and Lie of Franco,"" and to the Spanish artist's epic painting on war, ""Guernica,"" both from 1937. Yet even as Pollock's work engages with the history of art and offers a statement on the universal horrors of war, it also has a personal dimension, drawing on from the psychological language of Surrealism that fueled his early works.",20 5/8 x 26 in.,,,,,,,,,,,,,,,,,
604,Winter Pool,Robert Rauschenberg,1959,"Winter Pool, the first painting by Rauschenberg to enter the Museum's collection, is a prime example of a very important period in this highly inventive and influential artist's work—the mid-1950s to the early 1960s—when he created bold objects that were a hybrid of painting and sculpture and a reinvention of collage. He called them Combines. In Cubist collage, pasted papers add up to a readable image, such as a still life. With Combines, there is no narrative and the interpretation is left to the viewer. The work, in exceptionally fresh condition, consists of two separate canvases, each about the height of a man. A wooden ladder bridges the gap between them, and its legs extend to the floor, inviting the viewer to climb into the picture. The compositions of both canvases consist of syncopated grids formed by rectangles of paint and found objects: shirt cuffs, a handkerchief, poster letters, and photographic reproductions. Rauschenberg's virtuoso handling of paint both exploits and confronts the dominant painterly style of the early 1950s—Abstract Expressionism—and undermines the Renaissance notion that a painting shows an ideal world behind the canvas surface.",H. 90-1/2 x W. 59-1/2 x D. 4 in.,,,,,,,,,,,,,,,,,
605,Attic,Willem de Kooning,1949,"Between 1946 and 1949, de Kooning produced a series of highly abstract black-and-white-paintings that culminated in ""Attic,"" in which angular, thrusting forms collide with organic, curvilinear ones to yield a high-pitched, expressive picture. The dense web of white shapes and black lines makes it difficult to sort out relationships between form and space, though it is still possible to determine a figural basis for the scene. Stretched across the canvas are biomorphic symbols and shapes that allude to the curves and forms of human anatomy. De Kooning's palette of black and white, with touches of red and yellow, was determined in part by the availability of inexpensive commercial enamel paint. Although restricted in his use of color, de Kooning displays virtuosity in his sensuous, expressive handling of paint, surface, and line. His gestural brushwork and dynamic allover composition exemplify the new visual language adopted by the Abstract Expressionist painters. De Kooning routinely made revisions on his canvases, and ""Attic"" was exhibited at two different stages of completion. To accelerate the drying time of the paint, he blotted sheets of newspaper over the wet canvas, and the surface bears evidence of transferred newsprint. Immediately following ""Attic,"" de Kooning reintroduced full color into his work, already hinted at here in the touches of red and yellow, and he soon returned to the figurative imagery for which he is best known.",61 7/8 x 81 in.,,,,,,,,,,,,,,,,,
606,"No. 13 (White, Red on Yellow)",Mark Rothko,1958,"Abstract Expressionism, the style of painting that achieved prominence in the 1950s, encompasses two very different sensibilities. One, exemplified by the work of Jackson Pollock and Willem de Kooning, is characterized by energetic brushwork and rhythmic, dynamic compositions; the other, contemplative in tone and made up of subtle color harmonies, relatively static compositions, and simple forms, is embodied by the paintings of Mark Rothko.",95 1/4 × 81 3/8 in.,,,,,,,,,,,,,,,,,
607,Autumn Rhythm (Number 30),Jackson Pollock,1950,"In Autumn Rhythm, as in many of his paintings, Pollock first created a complex linear skeleton using black paint. For this initial layer the paint was diluted, so that it soaked into the length of unprimed canvas, thereby inextricably joining image and support. Over this black framework Pollock wove an intricate web of white, brown, and turquoise lines, which produce the contrary visual rhythms and sensations: light and dark, thick and thin, heavy and buoyant, straight and curved, horizontal and vertical. Textural passages that contribute to the painting's complexity — such as the pooled swirls where two colors meet and the wrinkled skins formed by the build-up of paint — are barely visible in the initial confusion of overlapping lines. Although Pollock's imagery is nonrepresentational, Autumn Rhythm is evocative of nature, not only in its title but also in its coloring, horizontal orientation, and sense of ground and space.",105 x 207 in.,,,,,,,,,,,,,,,,,
